{
  "schemaVersion": 1,
  "problemId": "bssc-sum-capacity",
  "subjectTransactionId": "33a5944dca980bf94cc869c6c7dee2d04385ff58",
  "acceptedClaimRefs": [
    {
      "transactionId": "33a5944dca980bf94cc869c6c7dee2d04385ff58",
      "claimKey": "bssc-sum-capacity/two-letter-marton-full-support-necessity",
      "judgmentId": "sha256:571e072efaeb33eb2f5e43a785cda31e611b2a1d4f2c82c7ada68d329c8f41a8",
      "assessmentDigest": "sha256:ffecb0c1e6dd98e261fe2aee99d428d72719ab6f53a61b37038b6e553b433aef"
    }
  ],
  "knowledgeStateDigest": "sha256:1f1a5676bbe127e34400973749883573966aec2c7901b03fd3476d1d0f4823bc",
  "seedNodeRefs": [
    {
      "kind": "thread",
      "id": "root/multiletter-marton-achievability/support-pruning"
    }
  ],
  "descendantDepth": 1,
  "includedNodes": [
    {
      "ref": {
        "kind": "program",
        "id": "root"
      },
      "parentRef": null,
      "status": "active",
      "roles": [
        "ancestor"
      ],
      "recordDigest": "sha256:6c667e70ec5eeb0bbca5cc382893b021b8e4dff33403e3ec09d92532f24e49dd"
    },
    {
      "ref": {
        "kind": "program",
        "id": "root/code-structure-converse"
      },
      "parentRef": {
        "kind": "program",
        "id": "root"
      },
      "status": "active",
      "roles": [
        "sibling-decision-point"
      ],
      "recordDigest": "sha256:b9dcb917359a21c184538fcd5afde2659b0ec70a3c8b37cda415f835ceb7af26"
    },
    {
      "ref": {
        "kind": "program",
        "id": "root/multiletter-marton-achievability"
      },
      "parentRef": {
        "kind": "program",
        "id": "root"
      },
      "status": "active",
      "roles": [
        "seed",
        "seed-owner",
        "sibling-decision-point"
      ],
      "recordDigest": "sha256:9e2d5f65b5d7fb621be9b028ba18577c20ffb8d8d35cb6b5b20e9f4c489d1c06"
    },
    {
      "ref": {
        "kind": "program",
        "id": "root/theorem9-auxiliary-receiver-converse"
      },
      "parentRef": {
        "kind": "program",
        "id": "root"
      },
      "status": "active",
      "roles": [
        "sibling-decision-point"
      ],
      "recordDigest": "sha256:fc129ebc86b318e8a8c08037a21bfd1de61cb4401f11d9e1a8ae3b10cf1e634d"
    },
    {
      "ref": {
        "kind": "program",
        "id": "root/uv-scalar-converse"
      },
      "parentRef": {
        "kind": "program",
        "id": "root"
      },
      "status": "active",
      "roles": [
        "sibling-decision-point"
      ],
      "recordDigest": "sha256:fcc703456c24e5b4761dfb3ffca9cee02cb267bebe124a36811b185069a0daec"
    },
    {
      "ref": {
        "kind": "thread",
        "id": "root/code-structure-converse/dependence-balance-and-channel-refinement"
      },
      "parentRef": {
        "kind": "program",
        "id": "root/code-structure-converse"
      },
      "status": "active",
      "roles": [
        "local-thread"
      ],
      "recordDigest": "sha256:be35b9071e3c1771d6de37cf8dedb082627ae39b1a8d02daa2cd2d4b401de358"
    },
    {
      "ref": {
        "kind": "thread",
        "id": "root/code-structure-converse/unstructured-search"
      },
      "parentRef": {
        "kind": "program",
        "id": "root/code-structure-converse"
      },
      "status": "active",
      "roles": [
        "local-thread"
      ],
      "recordDigest": "sha256:21542d60cc740c3de51655b277c1d05f68529005f8a3320e510f5e3b0dab75ef"
    },
    {
      "ref": {
        "kind": "thread",
        "id": "root/multiletter-marton-achievability-agenda"
      },
      "parentRef": {
        "kind": "program",
        "id": "root"
      },
      "status": "active",
      "roles": [
        "local-thread"
      ],
      "recordDigest": "sha256:679d41ee0298d910e1478e4db57c4c44219afe8fef3abbdb7f461e27857d0234"
    },
    {
      "ref": {
        "kind": "thread",
        "id": "root/multiletter-marton-achievability/conditional-product-and-correlation-pruning"
      },
      "parentRef": {
        "kind": "program",
        "id": "root/multiletter-marton-achievability"
      },
      "status": "active",
      "roles": [
        "local-thread"
      ],
      "recordDigest": "sha256:dcaaa20d57507eb13133345aaea93697c978793f9d06c3c6d389c878ec78c6eb"
    },
    {
      "ref": {
        "kind": "thread",
        "id": "root/multiletter-marton-achievability/support-pruning"
      },
      "parentRef": {
        "kind": "program",
        "id": "root/multiletter-marton-achievability"
      },
      "status": "active",
      "roles": [
        "local-thread",
        "seed"
      ],
      "recordDigest": "sha256:6fcf79adb059247646b2762e903a027bdac85c4dd1efda87fc151390be5eb060"
    },
    {
      "ref": {
        "kind": "thread",
        "id": "root/multiletter-marton-achievability/unstructured-search"
      },
      "parentRef": {
        "kind": "program",
        "id": "root/multiletter-marton-achievability"
      },
      "status": "active",
      "roles": [
        "local-thread"
      ],
      "recordDigest": "sha256:8de09a54e8183a3e9e37be60847de87b58b5595e9c54d7b7ea5bbed6dead8baa"
    },
    {
      "ref": {
        "kind": "thread",
        "id": "root/theorem9-auxiliary-receiver-converse-agenda"
      },
      "parentRef": {
        "kind": "program",
        "id": "root"
      },
      "status": "active",
      "roles": [
        "local-thread"
      ],
      "recordDigest": "sha256:45531074e7461c936ed926a0ca2727a7bba0463ec6b499a57982fb62dae84663"
    },
    {
      "ref": {
        "kind": "thread",
        "id": "root/theorem9-auxiliary-receiver-converse/r0-specialization-and-receiver-reduction"
      },
      "parentRef": {
        "kind": "program",
        "id": "root/theorem9-auxiliary-receiver-converse"
      },
      "status": "active",
      "roles": [
        "local-thread"
      ],
      "recordDigest": "sha256:e652298666da8a0fd022290925ba0067d21b2f217bdf432209dd068673c50a4c"
    },
    {
      "ref": {
        "kind": "thread",
        "id": "root/theorem9-auxiliary-receiver-converse/unstructured-search"
      },
      "parentRef": {
        "kind": "program",
        "id": "root/theorem9-auxiliary-receiver-converse"
      },
      "status": "active",
      "roles": [
        "local-thread"
      ],
      "recordDigest": "sha256:9f9280bbd49ae9d9fe41e5be39a13387a647aaf4dad7087c14b367b76b4f1036"
    },
    {
      "ref": {
        "kind": "thread",
        "id": "root/unstructured-search"
      },
      "parentRef": {
        "kind": "program",
        "id": "root"
      },
      "status": "active",
      "roles": [
        "local-thread"
      ],
      "recordDigest": "sha256:593d11c9f455aa91fa91e9083a6bb6ffcf4823726f6843239f552eb8fe24b48e"
    },
    {
      "ref": {
        "kind": "thread",
        "id": "root/uv-scalar-converse-agenda"
      },
      "parentRef": {
        "kind": "program",
        "id": "root"
      },
      "status": "active",
      "roles": [
        "local-thread"
      ],
      "recordDigest": "sha256:1ec5b7ce786e9f1df13aab296e9407b0ecb76bc59c6201f87f03e4b745fb5e18"
    },
    {
      "ref": {
        "kind": "thread",
        "id": "root/uv-scalar-converse/product-and-skew-symmetry"
      },
      "parentRef": {
        "kind": "program",
        "id": "root/uv-scalar-converse"
      },
      "status": "active",
      "roles": [
        "local-thread"
      ],
      "recordDigest": "sha256:206803453dcc63f60aef83904eb09d1b3a6ac2265b0581baa29798b977b9bd7d"
    },
    {
      "ref": {
        "kind": "thread",
        "id": "root/uv-scalar-converse/unstructured-search"
      },
      "parentRef": {
        "kind": "program",
        "id": "root/uv-scalar-converse"
      },
      "status": "active",
      "roles": [
        "local-thread"
      ],
      "recordDigest": "sha256:e3cb2726702d8a286ee254ceafdd5251f4412e4222fc7678ffc1c59be356dd9e"
    }
  ],
  "boundarySummaries": [],
  "semanticItemRefs": [
    {
      "itemId": "root/code-structure-converse/code-induced-dependence-balance",
      "programRef": {
        "kind": "program",
        "id": "root/code-structure-converse"
      },
      "itemType": "result",
      "claimRefs": [
        {
          "claimKey": "bssc-sum-capacity/code-induced-dependence-balance-and-entropy-no-go",
          "transactionId": "c70e1829a7c6a2a8cb8cfc2383f8abf825ac5ea6"
        }
      ],
      "dependencyItemIds": [
        "root/code-structure-converse/finite-block-balance-proof"
      ],
      "recordDigest": "sha256:f7f13394e11395e8d2f2728659d807142ed525017b688668eefdbfd92b06810d"
    },
    {
      "itemId": "root/code-structure-converse/copy-extension-proof",
      "programRef": {
        "kind": "program",
        "id": "root/code-structure-converse"
      },
      "itemType": "proof",
      "claimRefs": [],
      "dependencyItemIds": [
        "root/code-structure-converse/entropy-counterfeit-witness"
      ],
      "recordDigest": "sha256:7d4d8300feed467f40d7cab85ca12c51db03fb897daf2c88ae3aca9e8b11d2bf"
    },
    {
      "itemId": "root/code-structure-converse/entropy-copy-no-go",
      "programRef": {
        "kind": "program",
        "id": "root/code-structure-converse"
      },
      "itemType": "result",
      "claimRefs": [
        {
          "claimKey": "bssc-sum-capacity/code-induced-dependence-balance-and-entropy-no-go",
          "transactionId": "c70e1829a7c6a2a8cb8cfc2383f8abf825ac5ea6"
        }
      ],
      "dependencyItemIds": [
        "root/code-structure-converse/copy-extension-proof",
        "root/code-structure-converse/entropy-counterfeit-witness"
      ],
      "recordDigest": "sha256:4d3e3bb55a0cf45bcf1ed21e6dc7fbbc3462691f9b2907fa300128bd53a97d83"
    },
    {
      "itemId": "root/code-structure-converse/entropy-counterfeit-witness",
      "programRef": {
        "kind": "program",
        "id": "root/code-structure-converse"
      },
      "itemType": "computation",
      "claimRefs": [],
      "dependencyItemIds": [
        "root/code-structure-converse/code-induced-dependence-balance"
      ],